{
  "$schema": "https://json-schema.org/draft/2020-12/schema",
  "$id": "https://versiondrift.dev/schemas/feed-index.schema.json",
  "title": "VersionDrift feed: index.json (v1)",
  "description": "Generated from packages/schema (zod) by `pnpm schema:gen`. Do not edit by hand.",
  "type": "object",
  "properties": {
    "formatVersion": {
      "type": "string",
      "pattern": "^1\\.\\d+$"
    },
    "generatedAt": {
      "type": "string",
      "pattern": "^\\d{4}-\\d{2}-\\d{2}T\\d{2}:\\d{2}:\\d{2}Z$"
    },
    "collectorVersion": {
      "type": "string"
    },
    "products": {
      "type": "object",
      "propertyNames": {
        "type": "string"
      },
      "additionalProperties": {
        "type": "object",
        "properties": {
          "name": {
            "type": "string"
          },
          "category": {
            "type": "string"
          },
          "latest": {
            "type": [
              "string",
              "null"
            ]
          },
          "latestDate": {
            "anyOf": [
              {
                "type": "string",
                "pattern": "^\\d{4}-\\d{2}-\\d{2}T\\d{2}:\\d{2}:\\d{2}Z$"
              },
              {
                "type": "null"
              }
            ]
          },
          "tracks": {
            "type": "object",
            "propertyNames": {
              "type": "string"
            },
            "additionalProperties": {
              "type": "string"
            }
          },
          "maxSeverityLast30d": {
            "anyOf": [
              {
                "type": "string",
                "enum": [
                  "critical",
                  "high",
                  "medium",
                  "low",
                  "unknown"
                ]
              },
              {
                "type": "null"
              }
            ]
          },
          "hasSecuritySource": {
            "type": "boolean"
          },
          "updatedAt": {
            "type": "string",
            "pattern": "^\\d{4}-\\d{2}-\\d{2}T\\d{2}:\\d{2}:\\d{2}Z$"
          },
          "stale": {
            "type": "boolean"
          },
          "sha256": {
            "type": "string",
            "pattern": "^[0-9a-f]{64}$"
          },
          "url": {
            "type": "string"
          }
        },
        "required": [
          "name",
          "category",
          "latest",
          "latestDate",
          "tracks",
          "maxSeverityLast30d",
          "hasSecuritySource",
          "updatedAt",
          "stale",
          "sha256",
          "url"
        ],
        "additionalProperties": false
      }
    }
  },
  "required": [
    "formatVersion",
    "generatedAt",
    "collectorVersion",
    "products"
  ],
  "additionalProperties": false
}
