{"formatVersion":"1.2","generatedAt":"2026-09-25T21:01:17Z","collectorVersion":"0.1.0","products":{"grafana":{"name":"Grafana","category":"monitoring","latest":"13.2.2","latestDate":"2026-09-15T12:21:32Z","tracks":{"11":"11.6.16","12":"12.4.11","13":"13.2.2"},"maxSeverityLast30d":"high","hasSecuritySource":true,"updatedAt":"2026-09-25T21:01:17Z","stale":false,"sha256":"d60c99fc02a7914de4244567df1659a4fa5a77da1c376d123a66f53d4ecfe129","url":"products/grafana.json?v=d60c99fc02a7"},"nginx":{"name":"nginx","category":"web","latest":"1.31.6","latestDate":"2026-09-15T15:34:19Z","tracks":{"mainline":"1.31.6","stable":"1.30.5"},"maxSeverityLast30d":null,"hasSecuritySource":true,"updatedAt":"2026-09-25T21:01:17Z","stale":false,"sha256":"a3847fc99ebf1b920a9e7086dec2c8f763a1faf13bbc9a2560bc4162aeff2ea5","url":"products/nginx.json?v=a3847fc99ebf"},"debian":{"name":"Debian GNU/Linux","category":"os","latest":"13.7","latestDate":"2026-09-12T00:00:00Z","tracks":{"12":"12.15","13":"13.7"},"maxSeverityLast30d":null,"hasSecuritySource":true,"updatedAt":"2026-09-25T21:01:17Z","stale":false,"sha256":"87695d7ed0595d925e809b180c02fcab6cedf9a5f3179fcfa577abe1e4afd23c","url":"products/debian.json?v=87695d7ed059"},"routeros":{"name":"MikroTik RouterOS","category":"network","latest":"7.24.4","latestDate":"2026-09-16T15:34:02Z","tracks":{"7":"7.24.4"},"maxSeverityLast30d":"critical","hasSecuritySource":true,"updatedAt":"2026-09-25T21:01:17Z","stale":false,"sha256":"2e4ec6400322431a763723c97596de126e3688d2ece9bf04ca317ca1a8b6f58d","url":"products/routeros.json?v=2e4ec6400322"},"postgresql":{"name":"PostgreSQL","category":"database","latest":"18.6","latestDate":"2026-08-13T00:00:00Z","tracks":{"14":"14.24","15":"15.19","16":"16.15","17":"17.11","18":"18.6"},"maxSeverityLast30d":null,"hasSecuritySource":true,"updatedAt":"2026-09-25T21:01:17Z","stale":false,"sha256":"8b02e8ccb69df7247d1d8bdc2b42f1f109fe6000e69dbc300b2c3a9658f479d8","url":"products/postgresql.json?v=8b02e8ccb69d"},"poste-io":{"name":"poste.io","category":"mail","latest":"2.5.17","latestDate":"2026-09-18T19:37:14Z","tracks":{},"maxSeverityLast30d":null,"hasSecuritySource":false,"updatedAt":"2026-09-25T21:01:17Z","stale":false,"sha256":"48be3adc814af7064cde5ce89c334698f8cbfe9c191866915604c2590fe28921","url":"products/poste-io.json?v=48be3adc814a"},"zabbix":{"name":"Zabbix","category":"monitoring","latest":"7.4.15","latestDate":"2026-09-23T05:00:42Z","tracks":{"7.4":"7.4.15","7.0":"7.0.31","6.0":"6.0.48"},"maxSeverityLast30d":null,"hasSecuritySource":true,"updatedAt":"2026-09-25T21:01:17Z","stale":false,"sha256":"51ddf517d48bb6f092f2b4a54665a6d6e417f6c8fb8d1009cbd5f98170fea688","url":"products/zabbix.json?v=51ddf517d48b"},"proxmox-ve":{"name":"Proxmox VE","category":"virtualization","latest":"9.2","latestDate":"2026-05-21T00:00:00Z","tracks":{"8":"8.4","9":"9.2"},"maxSeverityLast30d":null,"hasSecuritySource":true,"updatedAt":"2026-09-25T21:01:17Z","stale":false,"sha256":"b7b17d97a5954f4ed3aaaf51508bc3a6f12cd34d6d057c1594677a7dd65b8443","url":"products/proxmox-ve.json?v=b7b17d97a595"},"elasticsearch":{"name":"Elasticsearch","category":"logging","latest":"9.5.4","latestDate":"2026-09-15T18:19:18Z","tracks":{"7":"7.17.29","8":"8.19.22","9":"9.5.4"},"maxSeverityLast30d":"high","hasSecuritySource":true,"updatedAt":"2026-09-25T21:01:17Z","stale":false,"sha256":"1e6faf4aba449c9fa44ff71923ec11251ae41a0990547d71a6f634e72c661fdc","url":"products/elasticsearch.json?v=1e6faf4aba44"},"kubernetes":{"name":"Kubernetes","category":"orchestration","latest":"1.37.1","latestDate":"2026-09-23T19:13:17Z","tracks":{},"maxSeverityLast30d":null,"hasSecuritySource":true,"updatedAt":"2026-09-25T21:01:17Z","stale":false,"sha256":"2407c19dfd87a3f35117e9a6bc00a3857025a704b21b235365869fcb778d2a1b","url":"products/kubernetes.json?v=2407c19dfd87"}}}